{"schema":"healthmd.artifact_plan","artifact_plan_version":2,"request_id":"native-android-wake-date-render","session_id":"native-android-wake-date","profile":"android_sleep_v6","items":[{"artifact_id":"aa725ffb02125017047fd9b1860289eaebec09984beeecfd85fb38d87adfaa14","relative_path":"health/2026-07-25.md","media_type":"text/markdown; charset=utf-8","write_mode":"overwrite","content_base64":"PiBIZWFsdGgubWQgc2xlZXAgYXR0cmlidXRpb246IGBtb3JuaW5nX2VuZHNgIChNb3JuaW5nIGVuZHMpOyB3aG9sZSBzZXNzaW9ucyBieSB3YWtlLXVwIGRhdGUuCj4gUHJvZmlsZTogYGFuZHJvaWQtc2xlZXAtdjZgOyBjYWxlbmRhciB0aW1lem9uZTogYEFzaWEvS2F0aG1hbmR1YDsgdGltZXN0YW1wIHRpbWV6b25lOiBgVVRDYDsgb3duZXIgcnVsZTogYHNlc3Npb25fZW5kX2RhdGVgOyBjbGlwcGluZzogYG5vbmVgLgoKPiBTbGVlcCBzdW1tYXJ5IGZhY3RzOiBgeyJzbGVlcF9saWdodF9ob3VycyI6NC4yNSwic2xlZXBfdG90YWxfaG91cnMiOjguMjV9YAoKIyBIZWFsdGggRGF0YSDigJQgMjAyNi0wNy0yNQoKIyMg8J+YtCBTbGVlcAotICoqVG90YWwgU2xlZXA6KiogOC4yNSBob3VyCi0gKipMaWdodCBTbGVlcDoqKiA0LjI1IGhvdXJzCgojIyDwn4+DIEFjdGl2aXR5Ci0gKipTdGVwczoqKiAxMjM0IGNvdW50Cg==","byte_count":463,"sha256":"c6b18f2c6a8386f2fd8ab7183476edaedf17cd7a0ed361ddbc070707454199b5"},{"artifact_id":"75b13c102ce1e37f283042df2fe5272ee30a986360e137f262143d80a98f6a9e","relative_path":"health/2026-07-25-bases.md","media_type":"text/markdown; charset=utf-8","write_mode":"overwrite","content_base64":"LS0tCnNjaGVtYTogaGVhbHRobWQuaGVhbHRoX2RhdGEKc2NoZW1hX3ZlcnNpb246IDYKc2NoZW1hX3Byb2ZpbGU6IGFuZHJvaWQtc2xlZXAtdjYKdGltZV9jb250ZXh0OgogIGNhbGVuZGFyX3RpbWV6b25lOiBBc2lhL0thdGhtYW5kdQogIHRpbWVzdGFtcF90aW1lem9uZTogVVRDCiAgc2xlZXBfZGF5X2F0dHJpYnV0aW9uOiBtb3JuaW5nX2VuZHMKICBzbGVlcF9vd25lcl9kYXlfcnVsZTogc2Vzc2lvbl9lbmRfZGF0ZQogIHNsZWVwX2ludGVydmFsX2NsaXBwaW5nOiBub25lCmRhdGU6IDIwMjYtMDctMjUKdHlwZTogaGVhbHRoLWRhdGEKc2xlZXBfdG90YWxfaG91cnM6IDguMjUKc2xlZXBfbGlnaHRfaG91cnM6IDQuMjUKc3RlcHM6IDEyMzQKLS0tCg==","byte_count":370,"sha256":"d9b6616c159fc7a52150abcce565397de0d35554102a677986b4d7172908f4ff"},{"artifact_id":"3d2fff5954f0c6cd028db8832f1ad7abf30d4d77f2dddbadbe91f72373b0d6ce","relative_path":"health/2026-07-25.json","media_type":"application/json","write_mode":"overwrite","content_base64":"ewogICAgImRhdGUiOiAiMjAyNi0wNy0yNSIsCiAgICAidHlwZSI6ICJoZWFsdGgtZGF0YSIsCiAgICAidW5pdHMiOiAibWV0cmljIiwKICAgICJzY2hlbWFQcm9maWxlIjogImFuZHJvaWQtc2xlZXAtdjYiLAogICAgInNjaGVtYVZlcnNpb24iOiA2LAogICAgInNjaGVtYSI6ICJoZWFsdGhtZC5oZWFsdGhfZGF0YSIsCiAgICAic2NoZW1hX3ZlcnNpb24iOiA2LAogICAgInNjaGVtYV9wcm9maWxlIjogImFuZHJvaWQtc2xlZXAtdjYiLAogICAgInVuaXRfc3lzdGVtIjogIm1ldHJpYyIsCiAgICAidGltZV9jb250ZXh0IjogewogICAgICAgICJjYWxlbmRhcl90aW1lem9uZSI6ICJBc2lhL0thdGhtYW5kdSIsCiAgICAgICAgInNsZWVwX2RheV9hdHRyaWJ1dGlvbiI6ICJtb3JuaW5nX2VuZHMiLAogICAgICAgICJzbGVlcF9pbnRlcnZhbF9jbGlwcGluZyI6ICJub25lIiwKICAgICAgICAic2xlZXBfb3duZXJfZGF5X3J1bGUiOiAic2Vzc2lvbl9lbmRfZGF0ZSIsCiAgICAgICAgInRpbWVzdGFtcF90aW1lem9uZSI6ICJVVEMiCiAgICB9LAogICAgInNsZWVwIjogewogICAgICAgICJzbGVlcF9saWdodF9ob3VycyI6IDQuMjUsCiAgICAgICAgInNsZWVwX3RvdGFsX2hvdXJzIjogOC4yNQogICAgfSwKICAgICJhY3Rpdml0eSI6IHsKICAgICAgICAic3RlcHMiOiAxMjM0CiAgICB9Cn0=","byte_count":671,"sha256":"b5fb59b46d086bcf6b9f535d6fc3935b927f5c87d8c00f6274e63d8ec7301018"},{"artifact_id":"ffe77ae774ba2d5d071907a87d9adbe099748ea53b858b82be3a8c80283ab8d6","relative_path":"health/2026-07-25.csv","media_type":"text/csv; charset=utf-8","write_mode":"overwrite","content_base64":"RGF0ZSxDYXRlZ29yeSxNZXRyaWMsVmFsdWUsVW5pdCxUaW1lc3RhbXAKMjAyNi0wNy0yNSxNZXRhZGF0YSxzY2hlbWEsaGVhbHRobWQuaGVhbHRoX2RhdGEsLAoyMDI2LTA3LTI1LE1ldGFkYXRhLHNjaGVtYV92ZXJzaW9uLDYsLAoyMDI2LTA3LTI1LE1ldGFkYXRhLHNjaGVtYV9wcm9maWxlLGFuZHJvaWQtc2xlZXAtdjYsLAoyMDI2LTA3LTI1LE1ldGFkYXRhLHVuaXRfc3lzdGVtLG1ldHJpYywsCjIwMjYtMDctMjUsTWV0YWRhdGEsdGltZV9jb250ZXh0LmNhbGVuZGFyX3RpbWV6b25lLEFzaWEvS2F0aG1hbmR1LCwKMjAyNi0wNy0yNSxNZXRhZGF0YSx0aW1lX2NvbnRleHQudGltZXN0YW1wX3RpbWV6b25lLFVUQywsCjIwMjYtMDctMjUsTWV0YWRhdGEsdGltZV9jb250ZXh0LnNsZWVwX2RheV9hdHRyaWJ1dGlvbixtb3JuaW5nX2VuZHMsLAoyMDI2LTA3LTI1LE1ldGFkYXRhLHRpbWVfY29udGV4dC5zbGVlcF9vd25lcl9kYXlfcnVsZSxzZXNzaW9uX2VuZF9kYXRlLCwKMjAyNi0wNy0yNSxNZXRhZGF0YSx0aW1lX2NvbnRleHQuc2xlZXBfaW50ZXJ2YWxfY2xpcHBpbmcsbm9uZSwsCjIwMjYtMDctMjUsU2xlZXAsVG90YWwgU2xlZXAsOC4yNSxob3VyLAoyMDI2LTA3LTI1LFNsZWVwLExpZ2h0IFNsZWVwLDQuMjUsaG91cnMsCjIwMjYtMDctMjUsQWN0aXZpdHksU3RlcHMsMTIzNCxjb3VudCwK","byte_count":678,"sha256":"77673fed8600939fd37e8e83be3de33ab7abdfb2e174941f0dca33376eca2966"}],"total_byte_count":2182}
